<?xml version="1.0" encoding="UTF-8"?>
<scenario xmlns:xsi="http://www.w3.org/2001/XMLSchema-instance"
        xsi:noNamespaceSchemaLocation="ScenarioSchema.xsd">
    <name>Scenario Loic</name>
    <flow id="1">
        <consumer>consumer1</consumer>
        <totalExecTimeInSec>60</totalExecTimeInSec>
        <frequencyInSec>10</frequencyInSec>
        <delayBetweenEachRequestInMs>0</delayBetweenEachRequestInMs>
        <request id="1">
            <producer>producer1</producer>
            <messageSize>256</messageSize>
            <processingTimeInMs>0</processingTimeInMs>
        </request>
    </flow>

</scenario>